{"release":{"release_id":"typed-candidate-v0.1","resources_digest":"sha256:2c7bd5f0a492646cb5cc250b426ed720f1e0953615172717f562379e88eeb691","urls_digest":"sha256:5bb70a7289ca6048275737ed771720e4e7d76c33bbd9fb34c3bc092956a693d1"},"schema":"r4b1t-terrain-index-v1","terrains":[{"count":22,"id":"dataset","label":"DATASET","members":[43,68,97,98,122,145,146,153,653,684,690,692,713,725,726,727,731,743,757,768,797,831],"rule":{"resource_type":["dataset"]}},{"count":1,"id":"documentation","label":"DOCUMENTATION","members":[180],"rule":{"resource_type":["documentation"]}},{"count":10,"id":"lab","label":"LAB","members":[654,655,656,657,658,659,660,661,662,695],"rule":{"resource_type":["lab"]}},{"count":123,"id":"reference","label":"REFERENCE","members":[1,12,13,29,31,37,44,51,52,57,58,59,60,61,62,63,64,73,74,76,78,87,89,90,91,92,93,94,99,100,105,107,108,109,110,111,112,113,114,115,116,117,125,127,132,133,135,136,137,147,150,156,167,643,652,663,666,667,672,673,677,678,679,680,681,682,683,691,697,698,699,711,721,728,732,733,735,736,738,745,746,747,748,749,751,752,753,754,755,762,769,770,771,772,773,774,775,776,777,778,779,780,781,782,783,784,785,786,787,788,790,791,792,793,794,795,800,801,803,805,822,824,830],"rule":{"resource_type":["reference"]}},{"count":470,"id":"repository","label":"REPOSITORY","members":[168,169,170,171,172,173,174,175,176,177,178,179,181,182,183,184,185,186,187,188,189,190,191,192,193,194,195,196,197,198,199,200,201,202,203,204,205,206,207,208,209,210,211,212,213,214,215,216,217,218,219,220,221,222,223,224,225,226,227,228,229,230,231,232,233,234,235,236,237,238,239,240,241,242,243,244,245,246,247,248,249,250,251,252,253,254,255,256,257,258,259,260,261,262,263,264,265,266,267,268,269,270,271,272,273,274,275,276,277,278,279,280,281,282,283,284,285,286,287,288,289,290,291,292,293,294,295,296,297,298,299,300,301,302,303,304,305,306,307,308,309,310,311,312,313,314,315,316,317,318,319,320,321,322,323,324,325,326,327,328,329,330,331,332,333,334,335,336,337,338,339,340,341,342,343,344,345,346,347,348,349,350,351,352,353,354,355,356,357,358,359,360,361,362,363,364,365,366,367,368,369,370,371,372,373,374,375,376,377,378,379,380,381,382,383,384,385,386,387,388,389,390,391,392,393,394,395,396,397,398,399,400,401,402,403,404,405,406,407,408,409,410,411,412,413,414,415,416,417,418,419,420,421,422,423,424,425,426,427,428,429,430,431,432,433,434,435,436,437,438,439,440,441,442,443,444,445,446,447,448,449,450,451,452,453,454,455,456,457,458,459,460,461,462,463,464,465,466,467,468,469,470,471,472,473,474,475,476,477,478,479,480,481,482,483,484,485,486,487,488,489,490,491,492,493,494,495,496,497,498,499,500,501,502,503,504,505,506,507,508,509,510,511,512,513,514,515,516,517,518,519,520,521,522,523,524,525,526,527,528,529,530,531,532,533,534,535,536,537,538,539,540,541,542,543,544,545,546,547,548,549,550,551,552,553,554,555,556,557,558,559,560,561,562,563,564,565,566,567,568,569,570,571,572,573,574,575,576,577,578,579,580,581,582,583,584,585,586,587,588,589,590,591,592,593,594,595,596,597,598,599,600,601,602,603,604,605,606,607,608,609,610,611,612,613,614,615,616,617,618,619,620,621,622,623,624,625,626,627,628,629,630,631,632,633,634,635,636,637,638],"rule":{"resource_type":["repository"]}},{"count":203,"id":"security_tool","label":"SECURITY TOOL","members":[2,3,4,5,6,7,8,9,11,14,15,16,17,18,19,20,21,22,23,24,25,26,27,28,30,32,33,34,35,38,39,40,41,42,46,47,48,49,50,53,54,55,56,65,66,67,69,70,71,72,75,77,79,80,81,82,83,84,85,86,88,95,101,102,103,118,119,120,121,123,124,126,128,129,130,131,134,138,139,140,141,142,143,144,148,149,151,152,154,155,157,158,159,160,161,162,163,164,165,166,639,640,641,642,644,645,646,647,648,649,650,651,664,665,668,669,670,671,674,675,676,685,686,687,688,689,693,694,696,700,701,703,704,705,706,707,708,709,710,712,714,715,716,717,718,719,720,722,723,724,729,730,734,737,739,740,741,742,750,758,759,760,761,763,764,766,767,789,796,798,799,804,806,807,808,809,810,811,812,813,814,815,816,817,818,819,820,821,823,825,826,827,828,829,832,833,834,835,836,837,838,839,840],"rule":{"resource_type":["security_tool"]}},{"count":12,"id":"training_resource","label":"TRAINING RESOURCE","members":[0,10,36,45,96,104,106,702,744,756,765,802],"rule":{"resource_type":["training_resource"]}}],"vocabulary":"resource-type-identity-v1"}
